{
  "schema": "animation.v1",
  "id": "FSA_ANIM_FPS_Firearm_Fire",
  "rig": "fps-arms.v1",
  "duration": 0.26,
  "loop": false,
  "mode": "timeline",
  "tracks": {
    "UpperArm_L": [
      {
        "time": 0,
        "rotation": [
          -15,
          0,
          0
        ]
      },
      {
        "time": 0.0225,
        "rotation": [
          -17.5,
          0,
          0
        ]
      },
      {
        "time": 0.045,
        "rotation": [
          -20,
          0,
          0
        ]
      },
      {
        "time": 0.07,
        "rotation": [
          -18.96296,
          0,
          0
        ]
      },
      {
        "time": 0.095,
        "rotation": [
          -17.03704,
          0,
          0
        ]
      },
      {
        "time": 0.12,
        "rotation": [
          -16,
          0,
          0
        ]
      },
      {
        "time": 0.14333,
        "rotation": [
          -15.92593,
          0,
          0
        ]
      },
      {
        "time": 0.16667,
        "rotation": [
          -15.74074,
          0,
          0
        ]
      },
      {
        "time": 0.19,
        "rotation": [
          -15.5,
          0,
          0
        ]
      },
      {
        "time": 0.21333,
        "rotation": [
          -15.25926,
          0,
          0
        ]
      },
      {
        "time": 0.23667,
        "rotation": [
          -15.07407,
          0,
          0
        ]
      },
      {
        "time": 0.26,
        "rotation": [
          -15,
          0,
          0
        ]
      }
    ],
    "Forearm_L": [
      {
        "time": 0,
        "rotation": [
          40,
          0,
          0
        ]
      },
      {
        "time": 0.0225,
        "rotation": [
          39.5,
          0,
          0
        ]
      },
      {
        "time": 0.045,
        "rotation": [
          39,
          0,
          0
        ]
      },
      {
        "time": 0.07,
        "rotation": [
          39.25926,
          0,
          0
        ]
      },
      {
        "time": 0.095,
        "rotation": [
          39.74074,
          0,
          0
        ]
      },
      {
        "time": 0.12,
        "rotation": [
          40,
          0,
          0
        ]
      },
      {
        "time": 0.14333,
        "rotation": [
          40,
          0,
          0
        ]
      },
      {
        "time": 0.16667,
        "rotation": [
          40,
          0,
          0
        ]
      },
      {
        "time": 0.19,
        "rotation": [
          40,
          0,
          0
        ]
      },
      {
        "time": 0.21333,
        "rotation": [
          40,
          0,
          0
        ]
      },
      {
        "time": 0.23667,
        "rotation": [
          40,
          0,
          0
        ]
      },
      {
        "time": 0.26,
        "rotation": [
          40,
          0,
          0
        ]
      }
    ],
    "UpperArm_R": [
      {
        "time": 0,
        "rotation": [
          0,
          0,
          0
        ]
      },
      {
        "time": 0.0225,
        "rotation": [
          -3.5,
          0,
          0
        ]
      },
      {
        "time": 0.045,
        "rotation": [
          -7,
          0,
          0
        ]
      },
      {
        "time": 0.07,
        "rotation": [
          -5.7037,
          0,
          0
        ]
      },
      {
        "time": 0.095,
        "rotation": [
          -3.2963,
          0,
          0
        ]
      },
      {
        "time": 0.12,
        "rotation": [
          -2,
          0,
          0
        ]
      },
      {
        "time": 0.14333,
        "rotation": [
          -1.85185,
          0,
          0
        ]
      },
      {
        "time": 0.16667,
        "rotation": [
          -1.48148,
          0,
          0
        ]
      },
      {
        "time": 0.19,
        "rotation": [
          -1,
          0,
          0
        ]
      },
      {
        "time": 0.21333,
        "rotation": [
          -0.51852,
          0,
          0
        ]
      },
      {
        "time": 0.23667,
        "rotation": [
          -0.14815,
          0,
          0
        ]
      },
      {
        "time": 0.26,
        "rotation": [
          0,
          0,
          0
        ]
      }
    ],
    "Forearm_R": [
      {
        "time": 0,
        "rotation": [
          0,
          0,
          0
        ]
      },
      {
        "time": 0.0225,
        "rotation": [
          -1,
          0,
          0
        ]
      },
      {
        "time": 0.045,
        "rotation": [
          -2,
          0,
          0
        ]
      },
      {
        "time": 0.07,
        "rotation": [
          -1.22222,
          0,
          0
        ]
      },
      {
        "time": 0.095,
        "rotation": [
          0.22222,
          0,
          0
        ]
      },
      {
        "time": 0.12,
        "rotation": [
          1,
          0,
          0
        ]
      },
      {
        "time": 0.14333,
        "rotation": [
          0.92593,
          0,
          0
        ]
      },
      {
        "time": 0.16667,
        "rotation": [
          0.74074,
          0,
          0
        ]
      },
      {
        "time": 0.19,
        "rotation": [
          0.5,
          0,
          0
        ]
      },
      {
        "time": 0.21333,
        "rotation": [
          0.25926,
          0,
          0
        ]
      },
      {
        "time": 0.23667,
        "rotation": [
          0.07407,
          0,
          0
        ]
      },
      {
        "time": 0.26,
        "rotation": [
          0,
          0,
          0
        ]
      }
    ]
  },
  "stance": {
    "leftOffset": [
      -0.11,
      0,
      0.06
    ],
    "blend": "constant"
  }
}
