{
  "schema": "animation.v1",
  "id": "FSA_ANIM_EnchantAltar_Enchant",
  "rig": "nodes.v1",
  "targetModel": "FSA_WORLD_EnchantAltar",
  "duration": 2.4,
  "loop": false,
  "mode": "timeline",
  "tracks": {
    "Crystal": [
      {
        "time": 0,
        "position": [
          0,
          1.26,
          0
        ],
        "rotation": [
          0,
          0,
          0
        ]
      },
      {
        "time": 0.6,
        "position": [
          0,
          1.35,
          0
        ],
        "rotation": [
          0,
          40,
          0
        ]
      },
      {
        "time": 1.3,
        "position": [
          0,
          1.42,
          0
        ],
        "rotation": [
          0,
          85,
          0
        ]
      },
      {
        "time": 1.65,
        "position": [
          0,
          1.38,
          0
        ],
        "rotation": [
          0,
          105,
          0
        ]
      },
      {
        "time": 2.4,
        "position": [
          0,
          1.16,
          0
        ],
        "rotation": [
          0,
          120,
          0
        ]
      }
    ],
    "Ring_0": [
      {
        "time": 0,
        "position": [
          0,
          0.94,
          0
        ],
        "rotation": [
          0,
          0,
          0
        ],
        "scale": [
          1,
          1,
          1
        ]
      },
      {
        "time": 0.65,
        "position": [
          0,
          1.07,
          0
        ],
        "rotation": [
          0,
          12,
          0
        ],
        "scale": [
          1.14,
          1,
          1.14
        ]
      },
      {
        "time": 1.5,
        "position": [
          0,
          1.07,
          0
        ],
        "rotation": [
          0,
          25,
          0
        ],
        "scale": [
          1.14,
          1,
          1.14
        ]
      },
      {
        "time": 2.4,
        "position": [
          0,
          0.9,
          0
        ],
        "rotation": [
          0,
          0,
          0
        ],
        "scale": [
          0.86,
          1,
          0.86
        ]
      }
    ],
    "Ring_1": [
      {
        "time": 0,
        "position": [
          0,
          0.94,
          0
        ],
        "rotation": [
          0,
          0,
          0
        ],
        "scale": [
          1,
          1,
          1
        ]
      },
      {
        "time": 0.65,
        "position": [
          0,
          1.07,
          0
        ],
        "rotation": [
          0,
          12,
          0
        ],
        "scale": [
          1.14,
          1,
          1.14
        ]
      },
      {
        "time": 1.5,
        "position": [
          0,
          1.07,
          0
        ],
        "rotation": [
          0,
          25,
          0
        ],
        "scale": [
          1.14,
          1,
          1.14
        ]
      },
      {
        "time": 2.4,
        "position": [
          0,
          0.9,
          0
        ],
        "rotation": [
          0,
          0,
          0
        ],
        "scale": [
          0.86,
          1,
          0.86
        ]
      }
    ],
    "Ring_2": [
      {
        "time": 0,
        "position": [
          0,
          0.94,
          0
        ],
        "rotation": [
          0,
          0,
          0
        ],
        "scale": [
          1,
          1,
          1
        ]
      },
      {
        "time": 0.65,
        "position": [
          0,
          1.07,
          0
        ],
        "rotation": [
          0,
          12,
          0
        ],
        "scale": [
          1.14,
          1,
          1.14
        ]
      },
      {
        "time": 1.5,
        "position": [
          0,
          1.07,
          0
        ],
        "rotation": [
          0,
          25,
          0
        ],
        "scale": [
          1.14,
          1,
          1.14
        ]
      },
      {
        "time": 2.4,
        "position": [
          0,
          0.9,
          0
        ],
        "rotation": [
          0,
          0,
          0
        ],
        "scale": [
          0.86,
          1,
          0.86
        ]
      }
    ],
    "Ring_3": [
      {
        "time": 0,
        "position": [
          0,
          0.94,
          0
        ],
        "rotation": [
          0,
          0,
          0
        ],
        "scale": [
          1,
          1,
          1
        ]
      },
      {
        "time": 0.65,
        "position": [
          0,
          1.07,
          0
        ],
        "rotation": [
          0,
          12,
          0
        ],
        "scale": [
          1.14,
          1,
          1.14
        ]
      },
      {
        "time": 1.5,
        "position": [
          0,
          1.07,
          0
        ],
        "rotation": [
          0,
          25,
          0
        ],
        "scale": [
          1.14,
          1,
          1.14
        ]
      },
      {
        "time": 2.4,
        "position": [
          0,
          0.9,
          0
        ],
        "rotation": [
          0,
          0,
          0
        ],
        "scale": [
          0.86,
          1,
          0.86
        ]
      }
    ]
  }
}
