{
  "schema": "animation.v1",
  "id": "FSA_ANIM_FPS_Melee_Draw",
  "rig": "fps-arms.v1",
  "duration": 0.34,
  "loop": false,
  "mode": "timeline",
  "tracks": {
    "UpperArm_L": [
      {
        "time": 0,
        "rotation": [
          55,
          0,
          0
        ]
      },
      {
        "time": 0.02429,
        "rotation": [
          54.60648,
          0,
          0
        ]
      },
      {
        "time": 0.04857,
        "rotation": [
          53.50433,
          0,
          0
        ]
      },
      {
        "time": 0.07286,
        "rotation": [
          51.81207,
          0,
          0
        ]
      },
      {
        "time": 0.09714,
        "rotation": [
          49.64709,
          0,
          0
        ]
      },
      {
        "time": 0.12143,
        "rotation": [
          47.12836,
          0,
          0
        ]
      },
      {
        "time": 0.14571,
        "rotation": [
          44.37291,
          0,
          0
        ]
      },
      {
        "time": 0.17,
        "rotation": [
          41.5,
          0,
          0
        ]
      },
      {
        "time": 0.19429,
        "rotation": [
          38.62709,
          0,
          0
        ]
      },
      {
        "time": 0.21857,
        "rotation": [
          35.87164,
          0,
          0
        ]
      },
      {
        "time": 0.24286,
        "rotation": [
          33.35291,
          0,
          0
        ]
      },
      {
        "time": 0.26714,
        "rotation": [
          31.18793,
          0,
          0
        ]
      },
      {
        "time": 0.29143,
        "rotation": [
          29.49567,
          0,
          0
        ]
      },
      {
        "time": 0.31571,
        "rotation": [
          28.39352,
          0,
          0
        ]
      },
      {
        "time": 0.34,
        "rotation": [
          28,
          0,
          0
        ]
      }
    ],
    "Forearm_L": [
      {
        "time": 0,
        "rotation": [
          20,
          0,
          0
        ]
      },
      {
        "time": 0.02429,
        "rotation": [
          19.85418,
          0,
          0
        ]
      },
      {
        "time": 0.04857,
        "rotation": [
          19.4461,
          0,
          0
        ]
      },
      {
        "time": 0.07286,
        "rotation": [
          18.81916,
          0,
          0
        ]
      },
      {
        "time": 0.09714,
        "rotation": [
          18.0176,
          0,
          0
        ]
      },
      {
        "time": 0.12143,
        "rotation": [
          17.08449,
          0,
          0
        ]
      },
      {
        "time": 0.14571,
        "rotation": [
          16.06433,
          0,
          0
        ]
      },
      {
        "time": 0.17,
        "rotation": [
          15,
          0,
          0
        ]
      },
      {
        "time": 0.19429,
        "rotation": [
          13.93567,
          0,
          0
        ]
      },
      {
        "time": 0.21857,
        "rotation": [
          12.91551,
          0,
          0
        ]
      },
      {
        "time": 0.24286,
        "rotation": [
          11.9824,
          0,
          0
        ]
      },
      {
        "time": 0.26714,
        "rotation": [
          11.18084,
          0,
          0
        ]
      },
      {
        "time": 0.29143,
        "rotation": [
          10.5539,
          0,
          0
        ]
      },
      {
        "time": 0.31571,
        "rotation": [
          10.14582,
          0,
          0
        ]
      },
      {
        "time": 0.34,
        "rotation": [
          10,
          0,
          0
        ]
      }
    ],
    "UpperArm_R": [
      {
        "time": 0,
        "rotation": [
          55,
          0,
          0
        ]
      },
      {
        "time": 0.02429,
        "rotation": [
          54.46075,
          0,
          0
        ]
      },
      {
        "time": 0.04857,
        "rotation": [
          52.95036,
          0,
          0
        ]
      },
      {
        "time": 0.07286,
        "rotation": [
          50.63139,
          0,
          0
        ]
      },
      {
        "time": 0.09714,
        "rotation": [
          47.66449,
          0,
          0
        ]
      },
      {
        "time": 0.12143,
        "rotation": [
          44.21296,
          0,
          0
        ]
      },
      {
        "time": 0.14571,
        "rotation": [
          40.43689,
          0,
          0
        ]
      },
      {
        "time": 0.17,
        "rotation": [
          36.5,
          0,
          0
        ]
      },
      {
        "time": 0.19429,
        "rotation": [
          32.56311,
          0,
          0
        ]
      },
      {
        "time": 0.21857,
        "rotation": [
          28.78704,
          0,
          0
        ]
      },
      {
        "time": 0.24286,
        "rotation": [
          25.33551,
          0,
          0
        ]
      },
      {
        "time": 0.26714,
        "rotation": [
          22.36861,
          0,
          0
        ]
      },
      {
        "time": 0.29143,
        "rotation": [
          20.04964,
          0,
          0
        ]
      },
      {
        "time": 0.31571,
        "rotation": [
          18.53925,
          0,
          0
        ]
      },
      {
        "time": 0.34,
        "rotation": [
          18,
          0,
          0
        ]
      }
    ],
    "Forearm_R": [
      {
        "time": 0,
        "rotation": [
          20,
          0,
          0
        ]
      },
      {
        "time": 0.02429,
        "rotation": [
          19.34396,
          0,
          0
        ]
      },
      {
        "time": 0.04857,
        "rotation": [
          17.50733,
          0,
          0
        ]
      },
      {
        "time": 0.07286,
        "rotation": [
          14.68647,
          0,
          0
        ]
      },
      {
        "time": 0.09714,
        "rotation": [
          11.07885,
          0,
          0
        ]
      },
      {
        "time": 0.12143,
        "rotation": [
          6.88039,
          0,
          0
        ]
      },
      {
        "time": 0.14571,
        "rotation": [
          2.28887,
          0,
          0
        ]
      },
      {
        "time": 0.17,
        "rotation": [
          -2.5,
          0,
          0
        ]
      },
      {
        "time": 0.19429,
        "rotation": [
          -7.28887,
          0,
          0
        ]
      },
      {
        "time": 0.21857,
        "rotation": [
          -11.88039,
          0,
          0
        ]
      },
      {
        "time": 0.24286,
        "rotation": [
          -16.07885,
          0,
          0
        ]
      },
      {
        "time": 0.26714,
        "rotation": [
          -19.68647,
          0,
          0
        ]
      },
      {
        "time": 0.29143,
        "rotation": [
          -22.50733,
          0,
          0
        ]
      },
      {
        "time": 0.31571,
        "rotation": [
          -24.34396,
          0,
          0
        ]
      },
      {
        "time": 0.34,
        "rotation": [
          -25,
          0,
          0
        ]
      }
    ]
  }
}
